{
  "checkInterval": "30s",
  "readTimeout": "5s",
  "shutdownTimeout": "30s",
  "failureThreshold": 3,
  "httpPort": 8080,
  "logLevel": "info",
  "logFormat": "json",
  "canaryFile": ".health-check",
  "mounts": [
    {
      "name": "movies",
      "path": "/mnt/movies",
      "canaryFile": ".health-check",
      "failureThreshold": 3
    },
    {
      "name": "tv",
      "path": "/mnt/tv",
      "checkType": "directory",
      "failureThreshold": 5
    }
  ]
}
